{
	"id": "IdOfPointInterest",
	"type": "PointOfInterest",
	"name": "Y6042010 - Var-Entrevaux [Pont-levis]",
	"description": "Description du site Y6042010",
	"category": ["Numéro du WaterLevelAndRiverFlow dans le dictionnaire"],
	"dateCreated": "2016-06-29T15:59:09.22Z",
	"location": {
		"type": "Point",
		"coordinates": [7.26985643, 43.69770086]
	},
	"source": "http://[SourceOfThePOI]",
	"refSeeAlso": ["WaterLevelAndRiverFlow-201711071221"]
}